{
 "cohorts": [
  {
   "id": "teen",
   "label": "Teens",
   "phrase": "teens ages 12–17",
   "people": "teens",
   "ages": "12–17"
  },
  {
   "id": "young_adult",
   "label": "Young adults",
   "phrase": "young adults ages 18–25",
   "people": "young adults",
   "ages": "18–25"
  }
 ],
 "topics": [
  {
   "id": "depression_suicide",
   "label": "Depression and suicide"
  },
  {
   "id": "mental_illness",
   "label": "Mental illness and distress"
  },
  {
   "id": "care",
   "label": "Getting help"
  },
  {
   "id": "substance_use",
   "label": "Substance use"
  },
  {
   "id": "school_family_peers",
   "label": "School, family and friends"
  },
  {
   "id": "health",
   "label": "Overall health"
  }
 ],
 "groups": [
  {
   "id": "age_band",
   "label": "Age",
   "cohorts": [
    "teen",
    "young_adult"
   ],
   "crosses_only": false,
   "phrase": "{people} ages {level}",
   "levels": [
    {
     "id": "age_12_13",
     "label": "12–13",
     "phrase": null
    },
    {
     "id": "age_14_15",
     "label": "14–15",
     "phrase": null
    },
    {
     "id": "age_16_17",
     "label": "16–17",
     "phrase": null
    },
    {
     "id": "age_18_20",
     "label": "18–20",
     "phrase": null
    },
    {
     "id": "age_21_23",
     "label": "21–23",
     "phrase": null
    },
    {
     "id": "age_24_25",
     "label": "24–25",
     "phrase": null
    }
   ]
  },
  {
   "id": "sex",
   "label": "Sex",
   "cohorts": [
    "teen",
    "young_adult"
   ],
   "crosses_only": false,
   "phrase": "{level} {cohort}",
   "levels": [
    {
     "id": "male",
     "label": "Male",
     "phrase": "male {cohort}"
    },
    {
     "id": "female",
     "label": "Female",
     "phrase": "female {cohort}"
    }
   ]
  },
  {
   "id": "race_ethnicity",
   "label": "Race and ethnicity",
   "cohorts": [
    "teen",
    "young_adult"
   ],
   "crosses_only": false,
   "phrase": "{level} {cohort}",
   "levels": [
    {
     "id": "white",
     "label": "White (non-Hispanic)",
     "phrase": "non-Hispanic white {cohort}"
    },
    {
     "id": "black",
     "label": "Black (non-Hispanic)",
     "phrase": "non-Hispanic Black {cohort}"
    },
    {
     "id": "aian",
     "label": "American Indian or Alaska Native (non-Hispanic)",
     "phrase": "non-Hispanic American Indian or Alaska Native {cohort}"
    },
    {
     "id": "nhopi",
     "label": "Native Hawaiian or Pacific Islander (non-Hispanic)",
     "phrase": "non-Hispanic Native Hawaiian or Pacific Islander {cohort}"
    },
    {
     "id": "asian",
     "label": "Asian (non-Hispanic)",
     "phrase": "non-Hispanic Asian {cohort}"
    },
    {
     "id": "multiracial",
     "label": "Two or more races (non-Hispanic)",
     "phrase": "non-Hispanic multiracial {cohort}"
    },
    {
     "id": "hispanic",
     "label": "Hispanic or Latino",
     "phrase": "Hispanic or Latino {cohort}"
    }
   ]
  },
  {
   "id": "race_ethnicity_5",
   "label": "Race and ethnicity (5 groups)",
   "cohorts": [
    "teen",
    "young_adult"
   ],
   "crosses_only": true,
   "phrase": "{level} {cohort}",
   "levels": [
    {
     "id": "white",
     "label": "White (non-Hispanic)",
     "phrase": "non-Hispanic white {cohort}"
    },
    {
     "id": "black",
     "label": "Black (non-Hispanic)",
     "phrase": "non-Hispanic Black {cohort}"
    },
    {
     "id": "asian",
     "label": "Asian (non-Hispanic)",
     "phrase": "non-Hispanic Asian {cohort}"
    },
    {
     "id": "hispanic",
     "label": "Hispanic or Latino",
     "phrase": "Hispanic or Latino {cohort}"
    },
    {
     "id": "another_or_multiracial",
     "label": "Another race or multiracial",
     "phrase": "{people} of another race or who are multiracial"
    }
   ]
  },
  {
   "id": "poverty",
   "label": "Family income relative to the poverty line",
   "cohorts": [
    "teen",
    "young_adult"
   ],
   "crosses_only": false,
   "phrase": "{people} in families {level}",
   "levels": [
    {
     "id": "below_poverty",
     "label": "Below the poverty line",
     "phrase": "{people} in families below the poverty line"
    },
    {
     "id": "up_to_2x_poverty",
     "label": "Up to twice the poverty line",
     "phrase": "{people} in families earning up to twice the poverty line"
    },
    {
     "id": "above_2x_poverty",
     "label": "More than twice the poverty line",
     "phrase": "{people} in families earning more than twice the poverty line"
    }
   ]
  },
  {
   "id": "family_income",
   "label": "Family income",
   "cohorts": [
    "teen",
    "young_adult"
   ],
   "crosses_only": false,
   "phrase": "{people} in families earning {level}",
   "levels": [
    {
     "id": "under_20k",
     "label": "Less than $20,000",
     "phrase": "{people} in families earning less than $20,000"
    },
    {
     "id": "from_20k_to_49k",
     "label": "$20,000–$49,999",
     "phrase": null
    },
    {
     "id": "from_50k_to_74k",
     "label": "$50,000–$74,999",
     "phrase": null
    },
    {
     "id": "from_75k",
     "label": "$75,000 or more",
     "phrase": null
    }
   ]
  },
  {
   "id": "insurance",
   "label": "Health insurance",
   "cohorts": [
    "teen",
    "young_adult"
   ],
   "crosses_only": false,
   "phrase": "{people} ({level})",
   "levels": [
    {
     "id": "insured",
     "label": "Has health insurance",
     "phrase": "{people} with health insurance"
    },
    {
     "id": "uninsured",
     "label": "No health insurance",
     "phrase": "{people} without health insurance"
    }
   ]
  },
  {
   "id": "metro",
   "label": "Where they live",
   "cohorts": [
    "teen",
    "young_adult"
   ],
   "crosses_only": false,
   "phrase": "{people} ({level})",
   "levels": [
    {
     "id": "large_metro",
     "label": "Large metro area",
     "phrase": "{people} in large metro areas"
    },
    {
     "id": "small_metro",
     "label": "Small metro area",
     "phrase": "{people} in small metro areas"
    },
    {
     "id": "nonmetro",
     "label": "Nonmetro (rural) area",
     "phrase": "{people} in nonmetro (rural) areas"
    }
   ]
  },
  {
   "id": "parents_in_home",
   "label": "Parents in the home",
   "cohorts": [
    "teen"
   ],
   "crosses_only": false,
   "phrase": "{people} living with {level}",
   "levels": [
    {
     "id": "both_parents",
     "label": "Both parents",
     "phrase": "{people} living with both parents"
    },
    {
     "id": "one_parent",
     "label": "One parent",
     "phrase": "{people} living with one parent"
    },
    {
     "id": "neither_parent",
     "label": "Neither parent",
     "phrase": "{people} living with neither parent"
    }
   ]
  },
  {
   "id": "education",
   "label": "Education",
   "cohorts": [
    "young_adult"
   ],
   "crosses_only": false,
   "phrase": "{people} ({level})",
   "levels": [
    {
     "id": "less_than_high_school",
     "label": "Less than high school",
     "phrase": "{people} with less than a high school education"
    },
    {
     "id": "high_school_graduate",
     "label": "High school graduate",
     "phrase": "{people} who finished high school but not college"
    },
    {
     "id": "some_college",
     "label": "Some college or associate degree",
     "phrase": "{people} with some college or an associate degree"
    },
    {
     "id": "college_graduate",
     "label": "College graduate",
     "phrase": "{people} who graduated from college"
    }
   ]
  },
  {
   "id": "employment",
   "label": "Employment",
   "cohorts": [
    "young_adult"
   ],
   "crosses_only": false,
   "phrase": "{people} ({level})",
   "levels": [
    {
     "id": "full_time",
     "label": "Employed full time",
     "phrase": "{people} employed full time"
    },
    {
     "id": "part_time",
     "label": "Employed part time",
     "phrase": "{people} employed part time"
    },
    {
     "id": "unemployed",
     "label": "Unemployed",
     "phrase": "unemployed {cohort}"
    },
    {
     "id": "not_in_labor_force",
     "label": "Other (including students and not in the labor force)",
     "phrase": "{people} who are students or otherwise not in the labor force"
    }
   ]
  }
 ],
 "indicators": [
  {
   "id": "mde_py",
   "cohort": "teen",
   "topic": "depression_suicide",
   "label": "Major depressive episode in the past year",
   "phrase": "had a major depressive episode in the past year",
   "universe_phrase": null,
   "definition": "Had a period of at least two weeks in the past 12 months with a depressed mood or loss of interest or pleasure in daily activities, plus most of the other symptoms of depression, based on DSM criteria.",
   "source": "YMDEYR",
   "years": [
    2021,
    2022,
    2023,
    2024
   ],
   "caveats": [],
   "status": "launch"
  },
  {
   "id": "mde_lifetime",
   "cohort": "teen",
   "topic": "depression_suicide",
   "label": "Major depressive episode at some point in life",
   "phrase": "have had a major depressive episode at some point in their life",
   "universe_phrase": null,
   "definition": "Ever had a period of at least two weeks with a depressed mood or loss of interest or pleasure in daily activities, plus most of the other symptoms of depression, based on DSM criteria.",
   "source": "YMDELT",
   "years": [
    2021,
    2022,
    2023,
    2024
   ],
   "caveats": [],
   "status": "launch"
  },
  {
   "id": "mde_severe",
   "cohort": "teen",
   "topic": "depression_suicide",
   "label": "Major depressive episode with severe impairment",
   "phrase": "had a major depressive episode with severe impairment in the past year",
   "universe_phrase": null,
   "definition": "Had a major depressive episode in the past year that severely interfered with chores at home, school or work, family relationships, or social life (Sheehan Disability Scale). Percentages are out of all teens.",
   "source": "MDEIMPY",
   "years": [
    2021,
    2022,
    2023,
    2024
   ],
   "caveats": [],
   "status": "launch"
  },
  {
   "id": "suicide_thoughts",
   "cohort": "teen",
   "topic": "depression_suicide",